{
  "version": "1.0.0",
  "domain_boundary": {
    "domain": "ether",
    "max_molecular_weight": 300.0,
    "allowed_fragments": [
      "COC",
      "CCOCC",
      "C1CCOC1"
    ],
    "disallowed_fragments": [
      "[#16]",
      "[CX3](=O)[OX2]"
    ],
    "max_hbd": 0,
    "max_logp": 2.0
  },
  "tom_parameters": {
    "homo_offset": 0.0,
    "lumo_offset": 0.0,
    "gc_scale": 4.7937,
    "uq_scale": 0.95,
    "conjugation_length_cap": 16
  },
  "gc_fragments": [
    {
      "smarts": "O=C([O&X2])[O&X2]",
      "property": "dielectric",
      "correction": 2.0
    },
    {
      "smarts": "[O&D2]([C&X4])[C&X4]",
      "property": "dielectric",
      "correction": 1.5
    },
    {
      "smarts": "S(=O)(=O)[C&X4]",
      "property": "dielectric",
      "correction": 5.0
    },
    {
      "smarts": "S(=O)(=O)[O&X2]",
      "property": "dielectric",
      "correction": 5.5
    },
    {
      "smarts": "[S&X3](=O)[C&X4]",
      "property": "dielectric",
      "correction": 7.5
    }
  ],
  "uq_weights": {
    "ensemble_weight": 0.5,
    "calibration_factor": 1.0
  },
  "validation_metrics": {
    "spearman_rho": 0.6379,
    "mae": 21.9013,
    "rmse": 23.2218,
    "n_training": 26,
    "audit": {
      "coverage_probability": 0.95,
      "confidence_level": 0.9,
      "n_samples": 20,
      "pass": true
    }
  },
  "signature": "cac4b4ec65111d19347d474337e91928d32a72a9c9e76b71dcb1471e7bf0630c"
}